{
  "@context": "https://cheeleong.dev/troika-system-json/systems/context.jsonld",
  "@id": "https://cheeleong.dev/troika-system-json/objects/spells/presence.json",
  "@type": "Spell",
  "name": "Presence",
  "cost": 1,
  "description": "This Spell creates the sense of being watched by a patriarchal figure. Some find it comforting, others, not so much.",
  "testType": "rollUnder",
  "range": "area",
  "duration": "while_concentrating",
  "components": [
    "somatic",
    "verbal"
  ],
  "tags": [
    "illusion"
  ],
  "specialMechanics": [
    "Affects all in area",
    "Some find comforting, others disturbing",
    "Patriarchal watching sensation"
  ],
  "oopsEntry": true
}
