{
  "@context": "https://cheeleong.dev/troika-system-json/context.jsonld",
  "@id": "https://cheeleong.dev/troika-system-json/objects/spells/astral-reach.json",
  "@type": "Spell",
  "name": "Astral Reach",
  "cost": 1,
  "description": "The Sorcerers of the Academy of Doors are most famous for this one Spell. With it they may reach through any portal and into another known receptacle. For example they might use it to reach through to a safe in their manse via their purse. This Spell only allows partial translocation\u2014 the wizard cannot fully or permanently enter.",
  "duration": "Instantaneous action",
  "range": "Through known portals to known locations",
  "testType": "rollUnder"
}
