{
  "@context": "https://cheeleong.dev/troika-system-json/context.jsonld",
  "@id": "https://cheeleong.dev/troika-system-json/objects/spells/babble.json",
  "@type": "Spell",
  "name": "Babble",
  "cost": 2,
  "description": "The wizard speaks nonsense while watching the intended target, causing their words to trip and confuse. This may be done under their breath and relatively subtly.",
  "duration": "Until the confusion clears or target realizes what's happening",
  "range": "Target within sight",
  "testType": "rollUnder"
}
